{
  "schema_name": "gunnchos.airan_decision_bundle",
  "schema_version": "1.0.0",
  "run_id": "pixel-cal-1784756973874",
  "site_id": "gary",
  "policy_name": "service_priority",
  "policy_version": "1.0.0",
  "policy_configuration_hash": "71f29503d2538ad6e1640a9be8124b7de90b8c30e5ac61741e24be590797cdd9",
  "input_twin_state_hash": "e50910ebeff34de063dbcf8e8d559bc0f172657e22ffd18b0f1823065ee77623",
  "selected_actions": {
    "resource_block_allocation": [
      6.666666666666668,
      4.444444444444445,
      4.444444444444445,
      4.444444444444445
    ],
    "power_allocation": [
      1.5,
      1.3333333333333333,
      1.3333333333333333,
      1.3333333333333333
    ],
    "beam_action": null,
    "scheduling_priority": [
      0,
      1,
      2,
      3
    ],
    "selected_network": "terrestrial",
    "compute_placement": "local_edge",
    "local_edge_placement": false,
    "continuity_class": "degraded_ok"
  },
  "predicted_metrics": {
    "predicted_latency_ms": 88.00333123076922,
    "predicted_reliability": 1.0,
    "predicted_packet_loss_pct": 0.0,
    "energy_use_j": 39.40016656153846,
    "fairness": 0.9642857142857141,
    "service_continuity_utility": 0.8239933375384616,
    "capacity_utilization": 1.0
  },
  "confidence": {
    "score": 0.75,
    "notes": "Analytical metric model; not a field-validated predictor."
  },
  "constraint_violations": [],
  "runtime_s": 1.4958000974729657e-05,
  "peak_memory_mb": 72304.0,
  "decision_rationale": "Deterministic service-class priority weights. ReadyGary beam provider not used.",
  "producer": {
    "repository": "spectrumx-ai-ran-gary",
    "commit": "f7af6c7f7541360e07402f6927794116a1684d32"
  },
  "evidence_level": "controlled_device_measurement",
  "metric_model_assumptions": [
    {
      "name": "latency_utilization_model",
      "description": "predicted_latency = measured_latency * network_penalty * (1 + 0.4*utilization)",
      "assumption_class": "configured"
    },
    {
      "name": "reliability_from_loss",
      "description": "reliability = 1 - predicted_packet_loss_pct/100",
      "assumption_class": "configured"
    }
  ],
  "readygary_used": false,
  "random_seed": 0
}
