{
  "schema_name": "gunnchos.airan_decision_bundle",
  "schema_version": "1.0.0",
  "run_id": "pixel-cal-1784756973874",
  "site_id": "gary",
  "policy_name": "twin_informed",
  "policy_version": "1.0.0",
  "policy_configuration_hash": "58b3fd5702ea032711b855302a3c7cc66de899c0a0bf818bc1335c3454509f20",
  "input_twin_state_hash": "c62837e8497d3022819ab86d334ff0f315aa343d14748c2f21a3db731e148804",
  "selected_actions": {
    "resource_block_allocation": [
      5.000000125730221,
      4.999999867895137,
      5.00000064042265,
      5.000000104900117
    ],
    "power_allocation": [
      1.0,
      1.0,
      1.0,
      1.0
    ],
    "beam_action": null,
    "scheduling_priority": [
      0,
      1,
      2,
      3
    ],
    "selected_network": "terrestrial",
    "compute_placement": "hybrid",
    "local_edge_placement": true,
    "continuity_class": "degraded_ok"
  },
  "predicted_metrics": {
    "predicted_latency_ms": 88.00333215976775,
    "predicted_reliability": 1.0,
    "predicted_packet_loss_pct": 0.0,
    "energy_use_j": 39.40016716219948,
    "fairness": 0.9999999999999968,
    "service_continuity_utility": 0.8239933356804645,
    "capacity_utilization": 1.0
  },
  "confidence": {
    "score": 0.75,
    "notes": "Analytical metric model; not a field-validated predictor."
  },
  "constraint_violations": [],
  "runtime_s": 0.0010141530074179173,
  "peak_memory_mb": 79.47265625,
  "decision_rationale": "Twin-informed policy uses full twin context: outage, energy, privacy, continuity, compute nodes, and measurement quality on top of constrained optimization. ReadyGary beam provider not used.",
  "producer": {
    "repository": "spectrumx-ai-ran-gary",
    "commit": "f7af6c7f7541360e07402f6927794116a1684d32"
  },
  "evidence_level": "controlled_device_measurement",
  "metric_model_assumptions": [
    {
      "name": "latency_utilization_model",
      "description": "predicted_latency = measured_latency * network_penalty * (1 + 0.4*utilization)",
      "assumption_class": "configured"
    },
    {
      "name": "reliability_from_loss",
      "description": "reliability = 1 - predicted_packet_loss_pct/100",
      "assumption_class": "configured"
    }
  ],
  "readygary_used": false,
  "random_seed": 0
}
