{
  "schema_name": "gunnchos.airan_decision_bundle",
  "schema_version": "1.0.0",
  "run_id": "2026-07-22-synthetic-gary-learn-001",
  "site_id": "gary",
  "policy_name": "static_uniform",
  "policy_version": "1.0.0",
  "policy_configuration_hash": "8b48741f77fbd84b8651731a2c12ef63562baa8c02ef2fccd0f6d08e634f1e5d",
  "input_twin_state_hash": "323bbe1ecffed0b20c1faf27ce1819245728296f015c1a0471d49e7a8cea52f2",
  "selected_actions": {
    "resource_block_allocation": [
      5.0,
      5.0,
      5.0,
      5.0
    ],
    "power_allocation": [
      1.0,
      1.0,
      1.0,
      1.0
    ],
    "beam_action": null,
    "scheduling_priority": [
      0,
      1,
      2,
      3
    ],
    "selected_network": "terrestrial",
    "compute_placement": "cloud",
    "local_edge_placement": false,
    "continuity_class": "degraded_ok"
  },
  "predicted_metrics": {
    "predicted_latency_ms": 65.8,
    "predicted_reliability": 0.9976,
    "predicted_packet_loss_pct": 0.24000000000000005,
    "energy_use_j": 38.29,
    "fairness": 1.0,
    "service_continuity_utility": 0.8663158400000001,
    "capacity_utilization": 1.0
  },
  "confidence": {
    "score": 0.55,
    "notes": "Analytical metric model; not a field-validated predictor."
  },
  "constraint_violations": [],
  "runtime_s": 1.3348999345907941e-05,
  "peak_memory_mb": 77.875,
  "decision_rationale": "Equal spectrum share baseline; ignores twin service context. ReadyGary beam provider not used.",
  "producer": {
    "repository": "spectrumx-ai-ran-gary",
    "commit": "0686d47d77cbc9fb9cbce262cdae732996f106b5"
  },
  "evidence_level": "synthetic",
  "metric_model_assumptions": [
    {
      "name": "latency_utilization_model",
      "description": "predicted_latency = measured_latency * network_penalty * (1 + 0.4*utilization)",
      "assumption_class": "configured"
    },
    {
      "name": "reliability_from_loss",
      "description": "reliability = 1 - predicted_packet_loss_pct/100",
      "assumption_class": "configured"
    }
  ],
  "readygary_used": false,
  "random_seed": 0
}
